{
  "schema_version": "1.0.0",
  "standard": "GCL-AGENT-STAFFING-001",
  "standard_version": "1.0.0",
  "audit_method": "Exact protected-head scan of active instructions, contribution and pull-request guidance, governance documents, queues, mandates, prompt packs, and status records. Historical directives, closed decisions, immutable receipts, and exact evidence snapshots are retained as nonoperative provenance. A historical phrase is not counted as an operative conflict when current precedence is explicit.",
  "repositories": [
    {"repository": "grandchallenge/INTELLECT", "audited_commit": "7e01dc6b1be46171f0cba5e140ca881f6ab2f50f", "status": "covered", "operative_conflicting_language_count": 0, "historical_treatment": "retained_as_nonoperative_provenance", "notes": "GI-STEWARD-0002 and the one-time transition requirements remain historical; GI-STEWARD-0003 is selected prospectively."},
    {"repository": "grandchallenge/gcl-standards", "audited_commit": "d8912f8ca5224ce415b8316e2c07d04ee12bc194", "status": "covered", "operative_conflicting_language_count": 0, "historical_treatment": "retained_as_nonoperative_provenance", "notes": "Prior ADR and remediation evidence remain historical; the admitted standard and validator are operative."},
    {"repository": "grandchallenge/.github", "audited_commit": "e74f334c5a589e968a7676a0942c5a002f140f18", "status": "covered", "operative_conflicting_language_count": 0, "historical_treatment": "retained_as_nonoperative_provenance", "notes": "Organization defaults are current; immutable predecessor campaign and credential records remain provenance."},
    {"repository": "grandchallenge/MATH-PROGRAMME", "audited_commit": "bbe900f081d36e4a419c8841f8404ea4d7c1d8d9", "status": "covered", "operative_conflicting_language_count": 0, "historical_treatment": "retained_as_nonoperative_provenance", "notes": "Current operating instructions defer to the canonical standard; historical handoffs do not create prospective identity requirements."},
    {"repository": "grandchallenge/MATHFORGE", "audited_commit": "7a9deb652d577b5b9c389b241ce29ddd2e35f41a", "status": "covered", "operative_conflicting_language_count": 0, "historical_treatment": "none_identified", "notes": "Current documentary surfaces conform."},
    {"repository": "grandchallenge/MATHSOLVE", "audited_commit": "a4aeb36461e76c504fe7531fb239f3c30ca67c0e", "status": "covered", "operative_conflicting_language_count": 0, "historical_treatment": "none_identified", "notes": "Current documentary surfaces conform."},
    {"repository": "grandchallenge/MATHCERT", "audited_commit": "0efcea2e4f99fda4ea1b2fc3534b61cac779333a", "status": "covered", "operative_conflicting_language_count": 0, "historical_treatment": "none_identified", "notes": "The specialist rule prohibiting certification from sole construction or verification evidence remains an explicit outcome-level exception."},
    {"repository": "grandchallenge/AETHER", "audited_commit": "159cf930ae9130060f16d9fbc2608ad8a4069fae", "status": "covered", "operative_conflicting_language_count": 0, "historical_treatment": "none_identified", "notes": "Production-semantic activation and autonomous permission escalation remain reserved without imposing blanket identity multiplication."},
    {"repository": "grandchallenge/TROVE-CURATA", "audited_commit": "2c5661f22e3b2d1ebf7ed0224f7cca9472b43068", "status": "covered", "operative_conflicting_language_count": 0, "historical_treatment": "retained_as_nonoperative_provenance", "notes": "The older repository-acceptance packet remains provenance; destructive disposal and corpus admission gates remain explicit exceptions."},
    {"repository": "grandchallenge/BUTTERFLY", "audited_commit": "d0f726cbc86c8cb84bfbcd3663aff7bfca6b26b5", "status": "covered", "operative_conflicting_language_count": 0, "historical_treatment": "retained_with_prospective_coverage_note", "notes": "ADR-0003 is subordinate to the canonical standard; the BFC-REQUALIFICATION-002 distinct-session phrase is preserved as historical evidence and prospectively mapped to logical passes."},
    {"repository": "grandchallenge/GLOSS", "audited_commit": "eddf3da976a123c7f114046774aee41f44d572d6", "status": "covered", "operative_conflicting_language_count": 0, "historical_treatment": "none_identified", "notes": "Current documentary surfaces conform."},
    {"repository": "grandchallenge/MODULUS", "audited_commit": "6f7b6cbbdd532bad08da684d6bbb13476ddc9778", "status": "covered", "operative_conflicting_language_count": 0, "historical_treatment": "retained_as_nonoperative_provenance", "notes": "Immutable settings-readback evidence may contain predecessor text; active instructions conform."},
    {"repository": "grandchallenge/QUANTUM-TECHNOLOGIES", "audited_commit": "7afa7fcbf28dcd04f5ab47b6508cbd36a85a2d24", "status": "covered", "operative_conflicting_language_count": 0, "historical_treatment": "none_identified", "notes": "Current documentary surfaces conform."},
    {"repository": "grandchallenge/GCT-EXECUTIVE", "audited_commit": "0ca5a22f2895d26a3329c74afc26b0a107a44166", "status": "covered", "operative_conflicting_language_count": 0, "historical_treatment": "retained_with_prospective_coverage_note", "notes": "Current queues, mandates, scorecards, orchestration, and prompt packs were reconciled; closed decisions and campaign identities remain provenance."},
    {"repository": "grandchallenge/lean-action", "audited_commit": "37f8471aecd2efbeab3b1e1a75ad18fb8f5c1b01", "status": "covered", "operative_conflicting_language_count": 0, "historical_treatment": "none_identified", "notes": "Current documentary surfaces conform."},
    {"repository": "grandchallenge/upload-pages-artifact", "audited_commit": "4934497e00858680775a65f544192e61e1b1b3cb", "status": "covered", "operative_conflicting_language_count": 0, "historical_treatment": "none_identified", "notes": "Current documentary surfaces conform."}
  ],
  "unresolved_obligations": []
}
